{"count":15,"previous":null,"results":[{"url":"http:\/\/127.0.0.1:8000\/api\/v2\/egg-group\/1\/","name":"monster"},{"url":"http:\/\/127.0.0.1:8000\/api\/v2\/egg-group\/2\/","name":"water1"},{"url":"http:\/\/127.0.0.1:8000\/api\/v2\/egg-group\/3\/","name":"bug"},{"url":"http:\/\/127.0.0.1:8000\/api\/v2\/egg-group\/4\/","name":"flying"},{"url":"http:\/\/127.0.0.1:8000\/api\/v2\/egg-group\/5\/","name":"ground"},{"url":"http:\/\/127.0.0.1:8000\/api\/v2\/egg-group\/6\/","name":"fairy"},{"url":"http:\/\/127.0.0.1:8000\/api\/v2\/egg-group\/7\/","name":"plant"},{"url":"http:\/\/127.0.0.1:8000\/api\/v2\/egg-group\/8\/","name":"humanshape"},{"url":"http:\/\/127.0.0.1:8000\/api\/v2\/egg-group\/9\/","name":"water3"},{"url":"http:\/\/127.0.0.1:8000\/api\/v2\/egg-group\/10\/","name":"mineral"},{"url":"http:\/\/127.0.0.1:8000\/api\/v2\/egg-group\/11\/","name":"indeterminate"},{"url":"http:\/\/127.0.0.1:8000\/api\/v2\/egg-group\/12\/","name":"water2"},{"url":"http:\/\/127.0.0.1:8000\/api\/v2\/egg-group\/13\/","name":"ditto"},{"url":"http:\/\/127.0.0.1:8000\/api\/v2\/egg-group\/14\/","name":"dragon"},{"url":"http:\/\/127.0.0.1:8000\/api\/v2\/egg-group\/15\/","name":"no-eggs"}],"next":null}
