{
    "count": 9,
    "next": null,
    "previous": null,
    "results": [
        {
            "name": "cave",
            "url": "http://127.0.0.1:8000/api/v2/pokemon-habitat/1/"
        },
        {
            "name": "forest",
            "url": "http://127.0.0.1:8000/api/v2/pokemon-habitat/2/"
        },
        {
            "name": "grassland",
            "url": "http://127.0.0.1:8000/api/v2/pokemon-habitat/3/"
        },
        {
            "name": "mountain",
            "url": "http://127.0.0.1:8000/api/v2/pokemon-habitat/4/"
        },
        {
            "name": "rare",
            "url": "http://127.0.0.1:8000/api/v2/pokemon-habitat/5/"
        },
        {
            "name": "rough-terrain",
            "url": "http://127.0.0.1:8000/api/v2/pokemon-habitat/6/"
        },
        {
            "name": "sea",
            "url": "http://127.0.0.1:8000/api/v2/pokemon-habitat/7/"
        },
        {
            "name": "urban",
            "url": "http://127.0.0.1:8000/api/v2/pokemon-habitat/8/"
        },
        {
            "name": "waters-edge",
            "url": "http://127.0.0.1:8000/api/v2/pokemon-habitat/9/"
        }
    ]
}
