{"count":811,"previous":null,"results":[{"url":"http:\/\/127.0.0.1:8000\/api\/v2\/pokemon\/1\/","name":"bulbasaur"},{"url":"http:\/\/127.0.0.1:8000\/api\/v2\/pokemon\/2\/","name":"ivysaur"},{"url":"http:\/\/127.0.0.1:8000\/api\/v2\/pokemon\/3\/","name":"venusaur"},{"url":"http:\/\/127.0.0.1:8000\/api\/v2\/pokemon\/4\/","name":"charmander"},{"url":"http:\/\/127.0.0.1:8000\/api\/v2\/pokemon\/5\/","name":"charmeleon"},{"url":"http:\/\/127.0.0.1:8000\/api\/v2\/pokemon\/6\/","name":"charizard"},{"url":"http:\/\/127.0.0.1:8000\/api\/v2\/pokemon\/7\/","name":"squirtle"},{"url":"http:\/\/127.0.0.1:8000\/api\/v2\/pokemon\/8\/","name":"wartortle"},{"url":"http:\/\/127.0.0.1:8000\/api\/v2\/pokemon\/9\/","name":"blastoise"},{"url":"http:\/\/127.0.0.1:8000\/api\/v2\/pokemon\/10\/","name":"caterpie"},{"url":"http:\/\/127.0.0.1:8000\/api\/v2\/pokemon\/11\/","name":"metapod"},{"url":"http:\/\/127.0.0.1:8000\/api\/v2\/pokemon\/12\/","name":"butterfree"},{"url":"http:\/\/127.0.0.1:8000\/api\/v2\/pokemon\/13\/","name":"weedle"},{"url":"http:\/\/127.0.0.1:8000\/api\/v2\/pokemon\/14\/","name":"kakuna"},{"url":"http:\/\/127.0.0.1:8000\/api\/v2\/pokemon\/15\/","name":"beedrill"},{"url":"http:\/\/127.0.0.1:8000\/api\/v2\/pokemon\/16\/","name":"pidgey"},{"url":"http:\/\/127.0.0.1:8000\/api\/v2\/pokemon\/17\/","name":"pidgeotto"},{"url":"http:\/\/127.0.0.1:8000\/api\/v2\/pokemon\/18\/","name":"pidgeot"},{"url":"http:\/\/127.0.0.1:8000\/api\/v2\/pokemon\/19\/","name":"rattata"},{"url":"http:\/\/127.0.0.1:8000\/api\/v2\/pokemon\/20\/","name":"raticate"},{"url":"http:\/\/127.0.0.1:8000\/api\/v2\/pokemon\/21\/","name":"spearow"},{"url":"http:\/\/127.0.0.1:8000\/api\/v2\/pokemon\/22\/","name":"fearow"},{"url":"http:\/\/127.0.0.1:8000\/api\/v2\/pokemon\/23\/","name":"ekans"},{"url":"http:\/\/127.0.0.1:8000\/api\/v2\/pokemon\/24\/","name":"arbok"},{"url":"http:\/\/127.0.0.1:8000\/api\/v2\/pokemon\/25\/","name":"pikachu"},{"url":"http:\/\/127.0.0.1:8000\/api\/v2\/pokemon\/26\/","name":"raichu"},{"url":"http:\/\/127.0.0.1:8000\/api\/v2\/pokemon\/27\/","name":"sandshrew"},{"url":"http:\/\/127.0.0.1:8000\/api\/v2\/pokemon\/28\/","name":"sandslash"},{"url":"http:\/\/127.0.0.1:8000\/api\/v2\/pokemon\/29\/","name":"nidoran-f"},{"url":"http:\/\/127.0.0.1:8000\/api\/v2\/pokemon\/30\/","name":"nidorina"},{"url":"http:\/\/127.0.0.1:8000\/api\/v2\/pokemon\/31\/","name":"nidoqueen"},{"url":"http:\/\/127.0.0.1:8000\/api\/v2\/pokemon\/32\/","name":"nidoran-m"},{"url":"http:\/\/127.0.0.1:8000\/api\/v2\/pokemon\/33\/","name":"nidorino"},{"url":"http:\/\/127.0.0.1:8000\/api\/v2\/pokemon\/34\/","name":"nidoking"},{"url":"http:\/\/127.0.0.1:8000\/api\/v2\/pokemon\/35\/","name":"clefairy"},{"url":"http:\/\/127.0.0.1:8000\/api\/v2\/pokemon\/36\/","name":"clefable"},{"url":"http:\/\/127.0.0.1:8000\/api\/v2\/pokemon\/37\/","name":"vulpix"},{"url":"http:\/\/127.0.0.1:8000\/api\/v2\/pokemon\/38\/","name":"ninetales"},{"url":"http:\/\/127.0.0.1:8000\/api\/v2\/pokemon\/39\/","name":"jigglypuff"},{"url":"http:\/\/127.0.0.1:8000\/api\/v2\/pokemon\/40\/","name":"wigglytuff"},{"url":"http:\/\/127.0.0.1:8000\/api\/v2\/pokemon\/41\/","name":"zubat"},{"url":"http:\/\/127.0.0.1:8000\/api\/v2\/pokemon\/42\/","name":"golbat"},{"url":"http:\/\/127.0.0.1:8000\/api\/v2\/pokemon\/43\/","name":"oddish"},{"url":"http:\/\/127.0.0.1:8000\/api\/v2\/pokemon\/44\/","name":"gloom"},{"url":"http:\/\/127.0.0.1:8000\/api\/v2\/pokemon\/45\/","name":"vileplume"},{"url":"http:\/\/127.0.0.1:8000\/api\/v2\/pokemon\/46\/","name":"paras"},{"url":"http:\/\/127.0.0.1:8000\/api\/v2\/pokemon\/47\/","name":"parasect"},{"url":"http:\/\/127.0.0.1:8000\/api\/v2\/pokemon\/48\/","name":"venonat"},{"url":"http:\/\/127.0.0.1:8000\/api\/v2\/pokemon\/49\/","name":"venomoth"},{"url":"http:\/\/127.0.0.1:8000\/api\/v2\/pokemon\/50\/","name":"diglett"}],"next":"http:\/\/127.0.0.1:8000\/api\/v2\/pokemon\/?limit=50&offset=50"}
