{
    "count": 15,
    "next": null,
    "previous": null,
    "results": [
        {
            "name": "monster",
            "url": "http://localhost/api/v2/egg-group/1/"
        },
        {
            "name": "water1",
            "url": "http://localhost/api/v2/egg-group/2/"
        },
        {
            "name": "bug",
            "url": "http://localhost/api/v2/egg-group/3/"
        },
        {
            "name": "flying",
            "url": "http://localhost/api/v2/egg-group/4/"
        },
        {
            "name": "ground",
            "url": "http://localhost/api/v2/egg-group/5/"
        },
        {
            "name": "fairy",
            "url": "http://localhost/api/v2/egg-group/6/"
        },
        {
            "name": "plant",
            "url": "http://localhost/api/v2/egg-group/7/"
        },
        {
            "name": "humanshape",
            "url": "http://localhost/api/v2/egg-group/8/"
        },
        {
            "name": "water3",
            "url": "http://localhost/api/v2/egg-group/9/"
        },
        {
            "name": "mineral",
            "url": "http://localhost/api/v2/egg-group/10/"
        },
        {
            "name": "indeterminate",
            "url": "http://localhost/api/v2/egg-group/11/"
        },
        {
            "name": "water2",
            "url": "http://localhost/api/v2/egg-group/12/"
        },
        {
            "name": "ditto",
            "url": "http://localhost/api/v2/egg-group/13/"
        },
        {
            "name": "dragon",
            "url": "http://localhost/api/v2/egg-group/14/"
        },
        {
            "name": "no-eggs",
            "url": "http://localhost/api/v2/egg-group/15/"
        }
    ]
}
