{"count":10,"previous":null,"results":[{"url":"http:\/\/127.0.0.1:8000\/api\/v2\/move-learn-method\/1\/","name":"level-up"},{"url":"http:\/\/127.0.0.1:8000\/api\/v2\/move-learn-method\/2\/","name":"egg"},{"url":"http:\/\/127.0.0.1:8000\/api\/v2\/move-learn-method\/3\/","name":"tutor"},{"url":"http:\/\/127.0.0.1:8000\/api\/v2\/move-learn-method\/4\/","name":"machine"},{"url":"http:\/\/127.0.0.1:8000\/api\/v2\/move-learn-method\/5\/","name":"stadium-surfing-pikachu"},{"url":"http:\/\/127.0.0.1:8000\/api\/v2\/move-learn-method\/6\/","name":"light-ball-egg"},{"url":"http:\/\/127.0.0.1:8000\/api\/v2\/move-learn-method\/7\/","name":"colosseum-purification"},{"url":"http:\/\/127.0.0.1:8000\/api\/v2\/move-learn-method\/8\/","name":"xd-shadow"},{"url":"http:\/\/127.0.0.1:8000\/api\/v2\/move-learn-method\/9\/","name":"xd-purification"},{"url":"http:\/\/127.0.0.1:8000\/api\/v2\/move-learn-method\/10\/","name":"form-change"}],"next":null}
