{
    "count": 3,
    "next": null,
    "previous": null,
    "results": [
        {
            "name": "status",
            "url": "http://localhost/api/v2/move-damage-class/1/"
        },
        {
            "name": "physical",
            "url": "http://localhost/api/v2/move-damage-class/2/"
        },
        {
            "name": "special",
            "url": "http://localhost/api/v2/move-damage-class/3/"
        }
    ]
}
